,user_id,qid,topic,question,choice,opinions,demographic,user_answer,imp_model_answer,exp_model_answer,imexp_model_answer
14,26628,HARASS4_W41,America in 2050,"Now thinking about your own experiences have you ever personally received unwanted sexual advances or verbal or physical harassment of a sexual nature? This can be in any circumstance, whether or not work-related.","['Yes', 'No', 'Refused']","['The respondent believes that Social Security benefits should not be reduced in any way when thinking about the long-term future of Social Security.', 'When thinking about the future of the United States in 2050, about 30 years from now, the respondent stated that they are somewhat pessimistic', 'Major corporations will have a somewhat positive impact in solving the biggest problems facing the country in the future.', 'Most Americans will work into their 70s to have enough resources to retire, and it will definitely happen.', 'Increasing spending for roads, bridges, and other infrastructure is important, but not a top priority when deciding what the federal government should do to improve the quality', 'I think it is unlikely that the type of work I do will be done by robots or computers within the next 30 years.', 'The increased focus on sexual harassment and assault has made it harder for men to know how to interact with women in the workplace.', 'Reducing the national debt would be a top priority if deciding what the federal government should do to improve the quality of life for future generations.', 'The automation of jobs through new technology in the workplace has mostly hurt American workers.', 'Providing high-quality, affordable health care to all Americans is an important, but not a top priority when deciding what the federal government should do to improve', 'It is expected that by 2050, people will be about as likely to get married as they are now.', 'Population growth in the U.S. will be a major problem in 2050.', 'Colleges and universities will have a somewhat negative impact in solving the biggest problems facing the country in the future.', 'The share of Americans who are upper class will stay about the same over the next 30 years.', 'Women not being believed when they claim they have experienced sexual harassment or assault in the workplace today is a minor problem.']","[{'Age': '50-64'}, {'Citizenship': 'Yes'}, {'Region': 'Midwest'}, {'Education': 'Some college, no degree'}, {'Income': '$50,000-$75,000'}, {'Marital status': 'Divorced'}, {'Political ideology': 'Conservative'}, {'Political party': 'Independent'}, {'Race': 'White'}, {'Religion': 'Protestant'}, {'Frequency of religious attendance': 'Seldom'}, {'Gender': 'Male'}]",No,Yes,No,No
15,67566,GAP21Q41_W82,Global attitudes,"Overall, do you think current economic relations between the US and China are very good, somewhat good, somewhat bad or very bad?","['Very good', 'Somewhat good', 'Somewhat bad', 'Very bad', 'Refused']","['The US benefits a fair amount from being a member of the World Health Organization or WHO organizations.', 'Tensions between Mainland China and Hong Kong are not too serious of a problem for the US.', 'The US should play a shared leadership role in the world.', 'I am somewhat concerned that global climate change will harm me personally at some point in my lifetime.', ""America's economy is failing to recover from the effects of the coronavirus outbreak in ways that show the weaknesses of its economic system, even if neither statement is"", ""I am somewhat confident in Joe Biden's ability to make good decisions about international trade."", 'Having people of many different backgrounds, such as different ethnic groups, religions and races, makes the US a better place to live.', ""I don't have too much confidence in the healthcare system in the US to handle a future global health emergency that might occur."", 'Conflicts between people who live in cities and people who live in rural areas in the US are not very strong.', 'The US has done somewhat bad in dealing with the coronavirus outbreak.', ""China's growing technological power is a very serious problem for the US."", 'China has done a somewhat bad job dealing with the coronavirus outbreak.', 'The current economic situation in the US is very bad.', 'The speaker believes that we should pay less attention to problems overseas and concentrate on problems here at home.', 'Tensions between China and Taiwan are not too serious of a problem for the US.', ""The US should prioritize strengthening economic relations with China, even if it means not addressing human rights issues, according to the respondent's view.""]","[{'Age': '65+'}, {'Citizenship': 'Yes'}, {'Region': 'West'}, {'Education': 'High school graduate'}, {'Income': '$50,000-$75,000'}, {'Marital status': 'Never been married'}, {'Political ideology': 'Moderate'}, {'Political party': 'Democrat'}, {'Race': 'White'}, {'Religion': 'Nothing in particular'}, {'Frequency of religious attendance': 'Never'}, {'Gender': 'Female'}]",Somewhat bad,Very bad,Somewhat bad,Very bad
16,912,GUNRESPKIDSH_W26,Guns,"Thinking about gun owners who have children in their home, how important do you think it is for them to: Talk to their children about gun safety","['Essential', 'Important but not essential', 'Not important', 'Should not be done', 'Refused']","['I never visit websites about guns, hunting or other shooting sports.', ""People who commit suicide using a gun would be less likely to do it if they didn't have access to a gun."", 'The amount of gun violence in video games does not contribute too much to gun violence in the country today.', 'I have not taken any gun safety courses such as weapons training, hunter safety or firearm safety.', 'I never used air guns, such as paintball, BB or pellet guns when I was growing up.', 'I never attend gun shows.', 'Gun owners who have children in their home should keep their shooting skills up-to-date, but it is not essential.', 'I worry a little about being the victim of a violent crime.']","[{'Age': '65+'}, {'Citizenship': 'Yes'}, {'Region': 'Northeast'}, {'Education': 'Some college, no degree'}, {'Income': '$100,000 or more'}, {'Marital status': 'Married'}, {'Political ideology': 'Liberal'}, {'Political party': 'Independent'}, {'Race': 'White'}, {'Religion': 'Protestant'}, {'Frequency of religious attendance': 'Seldom'}, {'Gender': 'Female'}]",Essential,Important but not essential,Essential,Essential
17,72125,REPRSNTREP_W92,Political views,How well does the Republican party represent the interests of people like you?,"['Very well', 'Somewhat well', 'Not too well', 'Not at all well', 'Refused']","['The decline of white people as a share of the U.S. population is neither good nor bad for society.', 'Society is just as well off if people have priorities other than marriage and children.', 'Banks and other financial institutions are having a positive effect on the way things are going in the country these days.', 'Republicans in this country are very comfortable to freely and openly express their political views.', ""I think America's military should be kept about as is."", 'You would prefer to live in a community where the houses are smaller and closer to each other, but schools, stores, and restaurants are within walking distance', 'It would bother me a lot to regularly hear people speak a language other than English in public places in my community.', 'The statement that comes closer to my own views is that most things in society are too complicated to be clearly divided between good and evil.', 'The fact that there are some people in this country who have personal fortunes of a billion dollars or more is neither a good thing nor a bad thing.', 'Sometimes laws to protect people from themselves are necessary.', 'Believing in God is not important for a person to be considered good and moral, regardless of their own religious beliefs.', 'Increased public attention to the history of slavery and racism in America is generally very good for our society.', 'Preventing people who are not legally qualified to vote from casting a ballot is very important in elections in the country.', 'The country has made no progress over the last 50 years toward ensuring equal rights for all Americans regardless of their racial or ethnic backgrounds.']","[{'Age': '65+'}, {'Citizenship': 'Yes'}, {'Region': 'West'}, {'Education': 'Some college, no degree'}, {'Income': 'Less than $30,000'}, {'Marital status': 'Widowed'}, {'Political ideology': 'Moderate'}, {'Political party': 'Democrat'}, {'Race': 'White'}, {'Religion': 'Jewish'}, {'Frequency of religious attendance': 'Never'}, {'Gender': 'Female'}]",Not at all well,Somewhat well,Not at all well,Not at all well
18,22287,WHYNOTBIZF2I_W36,Gender & Leadership,"For each one of the following, please indicate whether you think it is a reason why there aren't more women in top executive business positions. Not as many women are interested in top executive business positions","['Major reason', 'Minor reason', 'Not a reason', 'Refused']","['It is essential for someone in a top executive business position to create a safe and respectful workplace.', 'It is essential for someone in a top executive business position to work well under pressure.', 'It would be very bad for the country if a woman was elected president.', 'It is essential for someone in a top executive business position to provide fair pay and good benefits.', 'Women in top executive business positions are better at standing up for what they believe in, despite pressure to make a profit, in general.', ""Being compassionate mostly helps a woman's chances of getting a top executive business position."", 'The answer provided is that as more women move into management roles, it is only a matter of time before there are as many women as men in top', 'Having more women in top leadership positions in business and government would not do much to improve the quality of life for women.', ""Women not doing as good of a job selling their accomplishments is not a reason why there aren't more women in top executive business positions."", ""Being compassionate mostly helps a man's chances of getting a top executive business position.""]","[{'Age': '50-64'}, {'Citizenship': 'Yes'}, {'Region': 'South'}, {'Education': 'High school graduate'}, {'Income': 'Less than $30,000'}, {'Marital status': 'Divorced'}, {'Political ideology': 'Conservative'}, {'Political party': 'Republican'}, {'Race': 'White'}, {'Religion': 'Protestant'}, {'Frequency of religious attendance': 'More than once a week'}, {'Gender': 'Male'}]",Minor reason,Not a reason,Minor reason,Not a reason
19,71111,INSTN_MSCENT_W92,Political views,Is the entertainment industry having a positive or negative effect on the way things are going in the country these days?,"['Positive effect', 'Negative effect', 'Refused']","['The decline of white people as a share of the U.S. population is neither good nor bad for society.', 'The statement that society is better off if people make marriage and having children a priority is closer to my own views.', 'Banks and other financial institutions are having a positive effect on the way things are going in the country these days.', 'I disapprove of the way Joe Biden is handling his job as president.', ""I think America's military should be kept about as is."", 'You would prefer to live in a community where the houses are larger and farther apart, but schools, stores, and restaurants are several miles away.', 'The country has made a lot of progress over the last 50 years toward ensuring equal rights for all Americans regardless of their racial or ethnic backgrounds.', 'The statement that comes closer to my own views is that most things in society are too complicated to be clearly divided between good and evil.', 'The fact that there are some people in this country who have personal fortunes of a billion dollars or more is neither a good thing nor a bad thing.', ""The answer given is that it is not the government's job to protect people from themselves."", ""Believing in God is important for a person to be considered good and moral, but it is not essential regardless of one's own religious beliefs."", 'Increased public attention to the history of slavery and racism in America is generally very bad for our society.', 'Preventing people who are not legally qualified to vote from casting a ballot is very important in elections in the country.', 'Nothing at all needs to be done to ensure equal rights for all Americans regardless of their racial or ethnic backgrounds.']","[{'Age': '65+'}, {'Citizenship': 'Yes'}, {'Region': 'South'}, {'Education': 'College graduate/some postgrad'}, {'Income': '$100,000 or more'}, {'Marital status': 'Married'}, {'Political ideology': 'Very conservative'}, {'Political party': 'Republican'}, {'Race': 'White'}, {'Religion': 'Protestant'}, {'Frequency of religious attendance': 'Once a week'}, {'Gender': 'Male'}]",Negative effect,Positive effect,Negative effect,Positive effect
20,51561,FAMSURV11M_W50,Family & Relationships,What do you think is the ideal situation for men with young children?,"['Working full-time for pay', 'Working part-time for pay', 'Not working for pay at all', 'Refused']","['I have more than one brother or sister.', 'Companionship was not a reason for getting married.', 'Having children is not important for a woman to live a fulfilling life in general.', 'Having children is not important for a man to live a fulfilling life.', 'My spouse or partner is of the opposite sex.', 'Having a lot of money is important, but not essential for a man to live a fulfilling life in general.', 'Things in your marriage/relationship are going fairly well.', 'I somewhat favor allowing unmarried couples to enter into legal agreements that would give them the same rights as married couples when it comes to things like health insurance,', 'The convenience was not a reason for getting married.', 'I am somewhat dissatisfied with how well my spouse/partner balances work and their personal life.', 'The respondent and their spouse have been married for 5 years to less than 10 years.', ""It doesn't make much difference who has it easier when it comes to achieving financial security goals.""]","[{'Age': '50-64'}, {'Citizenship': 'Yes'}, {'Region': 'South'}, {'Education': 'College graduate/some postgrad'}, {'Income': '$100,000 or more'}, {'Marital status': 'Married'}, {'Political ideology': 'Moderate'}, {'Political party': 'Independent'}, {'Race': 'White'}, {'Religion': 'Nothing in particular'}, {'Frequency of religious attendance': 'A few times a year'}, {'Gender': 'Female'}]",Working full-time for pay,Not working for pay at all,Working full-time for pay,Working full-time for pay
21,23310,TRAITBIZMF2A_W36,Gender & Leadership,"In general, how do you think being decisive impacts a man's chances of getting a top executive business position?","[""Mostly helps a man's chances"", ""Mostly hurts a man's chances"", ""Doesn't make much of a difference"", 'Refused']","[""Being ambitious mostly helps a woman's chances of getting a top executive business position."", 'Men would do a better job running a large oil or gas company types of companies.', 'It is essential for someone in a top executive business position to provide fair pay and good benefits.', 'It is essential for someone in a top executive business position to be honest and ethical.', 'It would be very bad for the country if a woman was elected president.', 'It is essential for someone in a top executive business position to work well under pressure.', 'Men are better at standing up for what they believe in, despite pressure to make a profit, in top executive business positions.', 'In general, when it comes to their approach to leadership, men and women are basically different in the leadership styles of people in top positions in business and', 'It is generally not much difference when thinking about top executive positions in business these days.', 'I am very happy with how things are in my life these days.', ""Being approachable does not make much of a difference in a woman's chances of getting a top executive business position."", 'I think more women running for U.S. Congress this year than in the past is a bad thing.']","[{'Age': '50-64'}, {'Citizenship': 'Yes'}, {'Region': 'South'}, {'Education': 'College graduate/some postgrad'}, {'Income': '$30,000-$50,000'}, {'Marital status': 'Married'}, {'Political ideology': 'Very conservative'}, {'Political party': 'Republican'}, {'Race': 'White'}, {'Religion': 'Protestant'}, {'Frequency of religious attendance': 'Once a week'}, {'Gender': 'Female'}]",Mostly helps a man's chances,Doesn't make much of a difference,Mostly helps a man's chances,Mostly helps a man's chances
22,60614,GOVPRIORITYe_W54,Economic inequality,How much of a priority should the following be for the federal government to address: Dealing with terrorism,"['A top priority', 'Important, but lower priority', 'Not too important', 'Should not be done', 'Refused']","['Our economic system requires major changes to address economic inequality in this country.', 'Churches and other religious organizations should have some responsibility in reducing economic inequality in our country.', ""The family's financial situation impacts the ability of children to succeed in life in the area where you live."", 'I have an IRA, 401K or a similar kind of retirement account.', ""The country's current economic conditions are neither helping nor hurting me and my family."", 'I or anyone in my household have not received medicaid benefits or government services and benefits in the past 12 months.', 'The federal government does not have a responsibility to provide a college education for all Americans.', ""The country's tax system is contributing a fair amount to my opinion about how the economy is doing."", 'I or anyone in my household have not received unemployment benefits or government services and benefits in the past 12 months.', ""The stock market affects my household's financial situation to a fair amount."", 'Investing in education and job training programs for people who are poor would be better for the government to address economic inequality in this country.', 'Increasing the federal minimum wage would do nothing to reduce economic inequality in the U.S.', 'Wages and incomes are contributing a fair amount to my opinion about how the economy is doing.', 'The federal government should have some responsibility in reducing economic inequality in our country.', 'The growing number of legal immigrants working in the U.S. contributes a great deal to economic inequality in this country.', ""I would rate economic conditions in this country today as only fair when thinking about the nation's economy.""]","[{'Age': '30-49'}, {'Citizenship': 'Yes'}, {'Region': 'South'}, {'Education': 'Postgraduate'}, {'Income': '$100,000 or more'}, {'Marital status': 'Married'}, {'Political ideology': 'Moderate'}, {'Political party': 'Other'}, {'Race': 'White'}, {'Religion': 'Protestant'}, {'Frequency of religious attendance': 'Once a week'}, {'Gender': 'Female'}]",A top priority,"Important, but lower priority",A top priority,"Important, but lower priority"
23,29683,PQ4_F2Aa_W42,Trust in science,"Thinking about medical doctors, how often would you say they do a good job providing diagnoses and treatment recommendations","['All or most of the time', 'Some of the time', 'Only a little of the time', 'None of the time', 'Refused']","['Hearing that a science practitioner is open to getting a second opinion on their recommendation makes people trust the recommendation more.', 'The answer given is that the scientific method can be used to produce any conclusion the researcher wants.', 'The following statement describes research scientists well: intelligent.', 'Environmental health specialists provide fair and accurate information when making recommendations all or most of the time.', 'I did not learn about dietitians in my job.', ""I don't have too much confidence in the news media to act in the best interests of the public."", 'Most medical doctors have good intentions, but the system is broken when it comes to professional misconduct among them.', 'I did not learn about medical doctors in my job.', 'I have a great deal of confidence in the military to act in the best interests of the public.', 'I know someone who is an environmental health specialist.', 'I did not learn about medical doctors in school.', 'Hearing that a science practitioner has received financial incentives from the federal government related to their work makes people trust the recommendation less.', 'The following statements describe research scientists well, without considering the moral values of society.', 'My view of environmental health specialists is mostly positive.', 'When hearing or reading news stories about professional misconduct by dietitians, people often think of these cases as isolated incidents.']","[{'Age': '65+'}, {'Citizenship': 'Yes'}, {'Region': 'South'}, {'Education': 'Postgraduate'}, {'Income': '$100,000 or more'}, {'Marital status': 'Widowed'}, {'Political ideology': 'Conservative'}, {'Political party': 'Republican'}, {'Race': 'White'}, {'Religion': 'Protestant'}, {'Frequency of religious attendance': 'Once a week'}, {'Gender': 'Female'}]",All or most of the time,Some of the time,All or most of the time,All or most of the time
24,260,GUNRESPNOKIDSG_W26,Guns,Thinking about gun owners who do not have children in their home how important do you think it is for them to: Keep their shooting skills up-to-date,"['Essential', 'Important but not essential', 'Not important', 'Should not be done', 'Refused']","['Lack of economic opportunities contributes a fair amount to gun violence in the country today.', 'People in my local community tend to look at most gun owners in a positive way.', 'I worry a little about having a personal health crisis.', 'The ease with which people can illegally obtain guns contributes a great deal to gun violence in the country today.', 'Sport shooting, including target shooting and trap and skeet, was not a reason for having guns in my household when I was growing up.', 'I worry a little about having my home broken into.', 'I hardly ever watch TV programs about guns or watch gun-oriented videos.', 'Gun owners who do not have children in their home should keep all of their guns in a locked place, but it is not essential.', 'My spouse or partner owns guns.']","[{'Age': '50-64'}, {'Citizenship': 'Yes'}, {'Region': 'South'}, {'Education': 'College graduate/some postgrad'}, {'Income': '$100,000 or more'}, {'Marital status': 'Married'}, {'Political ideology': 'Very conservative'}, {'Political party': 'Republican'}, {'Race': 'White'}, {'Religion': 'Protestant'}, {'Frequency of religious attendance': 'Once a week'}, {'Gender': 'Female'}]",Essential,Important but not essential,Essential,Important but not essential
25,14837,COMMYRS_W32,Community types & sexual harassment,About how many years have you lived in your local community?,"['Less than 1 year', '1-5 years', '6-10 years', '11-20 years', 'More than 20 years', 'Refused']","['Most of my neighbors are the same social class as me, as far as I know.', 'I live very close to the city my community is a suburb of.', 'In general, the impact of immigrants who live in the local community has been neither positive nor negative.', 'Employers firing men who have been accused of sexual harassment or assault before finding out all the facts are a minor problem when it comes to sexual harassment in', 'Abortion should be legal in all or most cases.', 'The statement that society is just as well off if people have priorities other than marriage and children is closer to my own views.', 'I have people I can turn to for support all or most of the time.', 'The person belongs in the lower-middle class if asked to use one of the commonly used names for social classes.', 'Sometimes, I feel too busy to enjoy life.', 'Most people who live in suburban areas have values that are somewhat similar to your values.', 'Knowing how to get along with people is essential in helping a young person succeed in the world today.', 'Sometimes, I feel lonely or isolated from those around me.', 'The answer does not apply.', 'I am somewhat satisfied with the quality of life in my local community.', ""The economic system in this country unfairly favors powerful interests, according to the respondent's views."", 'The condition of roads, bridges and other infrastructure is a minor problem in my local community.']","[{'Age': '50-64'}, {'Citizenship': 'Yes'}, {'Region': 'Midwest'}, {'Education': 'Postgraduate'}, {'Income': '$30,000-$50,000'}, {'Marital status': 'Never been married'}, {'Political ideology': 'Liberal'}, {'Political party': 'Independent'}, {'Race': 'White'}, {'Religion': 'Protestant'}, {'Frequency of religious attendance': 'A few times a year'}, {'Gender': 'Male'}]",11-20 years,1-5 years,11-20 years,11-20 years
